,title,intro,type,min_year_exp,max_year_exp,is_public,num_of_hires,is_remote,job_description,country_code,sal_mode,sal_min,sal_max,sal_currency_code,comp_name,comp_tagline,comp_verification,comp_is_hiring,comp_local_office,comp_description,country_name,country_demonym,country_currency,country_language
63,Business Analyst / Data Analyst,,FULL_TIME,1,3,True,1,False,"As a member of Haulio’s Business Analyst team, you will help to drive the analysis for company projects and strategic priorities, innovation and optimize our operations, and evaluate our financial performance.Responsibilities:Drive analysis and analytics on company projects and strategic prioritiesDevelop analytical frameworks to support the company in capturing new opportunities and developing new productsIdentify operational weaknesses and help to improve or innovate new processes to keep business operations as efficient as possibleDevelop and maintain financial models to analyze company’s financial performanceConduct research on the container and freight industry to identify opportunities and threatsCoordinate and collaborate with cross-functional teams from customer service to accounts to ensure alignment to company prioritiesRequirements:Bachelor’s degree in engineering, computer science, business analytics, economics, or business-related fields. Proficiency with statistics preferred.Curious and analytical mind that can make use of data to segment customers and generate insightsBalances attention to detail with swift execution – we do things quickly, and we need to do them wellSelf-starter who is able to work independently and flexiblyProficiency in BI tools (e.g. Qlik, Tableau) to visualize data in a compelling mannerExceptional skills with Microsoft Excel and MS Office SuiteAs a member of Haulio’s Business Analyst team, you will help to drive the analysis for company projects and strategic priorities, innovation and optimize our operations, and evaluate our financial performance.",SG,,,,,Haulio,"Haulio is the fastest way to reach out to the Haulage community. Where haulage meets technology, businesses coming to build a community, and sharing equates efficiency.",False,False,True,"Haulio is a fast-growing startup in the Container Haulage industry. Backed by the world’s leading Ports and Terminals Group, PSA, Haulio is solving a global Container Haulage infrastructural problem through new thinking and new technology.  

Haulio is the simplest & most reliable way for businesses to get their containers moved. As a centralised collaborative B2B platform for the Container Haulage Industry, we connect containers to customers. Haulio Community portal aims to maximize haulage resources through industry level sharing to improve job productivity and value-add to the end customers.Haulio’s platform works by intelligently matching targeted jobs to haulage companies (“hauliers”) and their prime movers, using advanced algorithms and IoT technology that optimises jobs’ specifications to locations, prime movers’ sizes and availability. With their technology, Haulio hopes to rewrite the rules of container haulage to ensure that every stakeholder stands to gain - Hauliers, Drivers, Forwarders, Cargo Owners and Port Operators.",Singapore,Singaporean,['SGD'],"['Mandarin', 'English', 'Malay', 'Tamil']"
64,Finance Central Data Management,,FULL_TIME,3,5,True,1,False,"Responsibilites :Responsible for providing data, regular reports and other requested reports related to Operational BusinessResponsible to making price list and margin determinationControlling overall about costing processAnalyze Cost Of Goods Sold and Analyze on product inventoryRequierements :Candidate must possess at least a Bachelor's Degree, Master's Degree / Post Graduate Degree, Finance/Accountancy/Banking or equivalent.At least 4 year(s) of working experience in the related field is required for this positionApplicants must be willing to work in Jakarta.Preferably Supervisor / Coordinators specializing in Finance - General/Cost Accounting or equivalent.Having good knowledge on Tax RegulationAttention to detail and accuracyExcellent in Excel and experience with Accounting Software Database (SAP)Demonstrates strong leadership",ID,MONTH,8000000.0,12000000.0,IDR,PT Time International,"Time International is an Indonesian company that delivers the widest range of leading international brands of timepieces, lifestyle products and services",False,False,True,"Time International is an Indonesian company that delivers the widest range of leading international brands of timepieces, lifestyle products and services. Based in Jakarta, Indonesia. The company currently holds over 45 brands, over 90 stores in 20 cities, with over 1000 staff and with more 20 years of retail experience.Currently, the company operates some of house of brands across the country The Time Place, INTime, @Time, Urban Icon, Project –X. Some of our brands boutique include Berluti, Breitling, Cartier, Chanel, Chanel FBP, Chopard, Diesel, Fendi, Innisfree, Fossil, Laneige,  Liebeskind, Poney, Red Valentino, Rip Curl, Rolex, Sweet Monster,  TAG Heuer, Tory Burch, Valentino.
 
With such a wide geographical and functional spread, we have opportunities in areas ranging in Head Office from Strategic Brand Management, Product and Operation, Service Centre, Supply Chain until General Administration and so forth.For more information about us, please visit www.timeinternational.co.id",Indonesia,Indonesian,['IDR'],['Indonesian']
65,Staff Admin Data Entry,,FULL_TIME,0,50,True,10,False,"INFO Pekerjaan Terbaru 2018 Lulusan SMA SMK D3 Sarjana - Full Time, Part Time, Freelance, Fresh Graduate, Mahasiswa/i.Berikut ini kami informasikan lowongan pekerjaan terbaru PT Mesindo Prima Autopart untuk posisi dan persyaratansebagai berikut.Posisi :1. Staff Administrasi2. Consumer Service3. Staff Accounting4. ReceptionistPersyaratan :· Pria / wanita usia min. 17 sd 35 tahun· Minimal lulusan SMA/K sederajat· Pengalaman /non pengalaman· Boleh berjilbab / berkacamata· Siap memajukan merusahaan· Bisa bekerja dalam team· Sopan, elegan jujur· Displin dalam kerja· Fresh graduateFasilitas yang di dapat dari perusahaan :- Gaji Pokok UMR (negotaible sesuai posisi)- Uang Makan + Transport- Insentif Kehadiran- Tunjangan Kesehatan- Jenjang Karir- Uang lembur ( overtime )- Jamsostek ( BPJS ) atau Askes- Penempatan kerja sesuai domisili- Bonus bulanan dan tahunan- Mess Jika Dari Luar JakartaCara Melamar :Bagi anda yang serius dan berminat kerja, silahkan kirim Cv /Data Diri Via SMS / WhatsApp kebagian HRD PerusahaanDengan Format :· Nama Lengkap:· Jenis Kelamin:· Tempat /Tgl. Lahir:· Pendidikan Terakhir:· Alamat Lengkap:· Posisi yang Dilamar :Kirim Kebagian HRD di No Hp/Wa : 0822·9711·2080Atau kirim cv lamaran via Email : hrd@mesindoprima.comSetelah kami terima data diri / cv lamaran yang anda kirim, maka HRD Perusahaan akan memberitahukan jadwal interview / panggilan kerja lewat Email, Whatsapp, Sms /Telpon. (Dihaarapkan Nomor Hp / WhatsApp dan e-mail anda selalu aktif)Note :* Lowongan dibuka selama iklan masih tayang.* Tidak melalui yayasan / outsourching.* Untuk yang baru lulus ijaza bisa menyusul.* Untuk penempatan kerja di kantor pusat, pabrik, dan kantor cabang sesuai domisili.""Bagi yang kuliah bisa Part-Time dan untuk yang baru lulus ijazah bisa menyusul dapat dengan melampirkan SKL (Surat Ket. Lulus)”",ID,MONTH,3700000.0,6000000.0,IDR,Pt Mesindo Prima Autopart,"PT Mesindo Prima Autopart merupakan perusahaan yang bergerak di bidang General Trading, Supplier dan Distributor Product Aftermarket Part di bidang Automotive.",False,False,True,,Indonesia,Indonesian,['IDR'],['Indonesian']
66,"Head, Data Analytics",,FULL_TIME,3,5,True,1,False,"We're looking for analytical and passionate people to join our proven team as Head, Data Analytics based in Singapore.Roles & ResponsibilitiesOversee and lead the development of the Deal Management System (our proprietary data-driven platform for screening and management of investments); structure and link databases, formalise and implement data collection systems, data analytics pertaining to platform metrics and financial data that we collect in the process of taking on investments, and other strategies that optimise statistical efficiency and qualityInterpret data, analyse results using statistical techniques, identify trends and patterns in complex data sets, and provide ongoing deal analytics reports to support investment decisionsContribute to data mining architectures, modelling standards, reporting, and data analysis methodologiesCollaborate with unit managers, end users, development staff, and other stakeholders to integrate Deal Management System and Analytics within existing systemsProcess, cleanse, and verify the integrity of data used for analysisIdentify and define new process optimisation opportunitiesProvide timely information and insights regarding customers, markets, and campaign effectiveness, to measure performance and support business decisions for product development and marketing enhancementImplementation and maintenance of web analytics tracking tools (i.e. Adobe Analytics/DTM and Google Analytics/GTM) to aid in collection of web analytics dataAble to gather insights from offline and online traffic sources to aid in marketing effortsRetrieval, monitoring, and analysis of all web analytics metrics to gain insights to support the marketing team with testing, decision making and further optimisationImproving the understanding of the customer's web behaviour and optimising the web experience through opportunity identification in tandem with the UX / UI teamLeading the CRM system used to collect and track customers on the Fundnel platformMaintenance of CRM tool – internally with the team and externally with vendorsOversee tech implementations for collection of customer dataProcess, cleanse, and verify the integrity of data used for analysis in CRM toolExtraction of data for KPI reporting and analysisTargeting customers using relevant customer activity/data sources through CRM toolManagerial role over the data management team (including hiring and monitoring the team)3rd party vendor management and integration for various analytics tools used across platformsSkills & Experience Required4+ years of experienceStrong experience with implementation of marketing analytics, tracking code and tag integrationExperience using Adobe Analytics, DTM, Google Analytics, GTMFamiliar with A-B / MVT testingData Visualisation experienceStrong analytical skills with the ability to collect, organise, analyse, and disseminate significant amounts of information with attention to detail and accuracyGood applied statistics skills, such as distributions, statistical testing, regression, etc.Technical expertise regarding data models, database design development, data mining and segmentationProficiency in Microsoft OfficePreference for Candidates with an understanding of machine learning techniques and algorithms, such as k-NN, Naive Bayes, SVM, Decision Forests, etc.A Diploma or Degree in Mathematics, Economics, Computer Science, Information Management or StatisticsThe ideal candidate should beInterested in dealing with data, including finding and exploring more efficient ways/programs (e.g. machine learning) to collect, store, and analyse dataAble to provide thought leadership in web/product analyticsPreferably have some understanding of terms in financial statements and financial ratiosPart of a product team working across various product domains with a focus on optimization of product through KPI's and metrics",SG,MONTH,5000.0,10000.0,SGD,Fundnel Limited,"We're helping everyone unlock private investments opportunities in businesses around, today.",False,False,True,"Fundnel is a private investment platform that offers unlisted securities in growth and pre-IPO stage companies across industries to a qualified network of investors, comprising of both professional – corporate venture, private equity, venture capital funds, family offices, angel investor networks – and individually accredited investors actively looking to diversify their current portfolio.Fundnel screens all investment opportunities to ensure businesses meet the minimum requirements defined by the Fundnel Factor – a proprietary data-driven deal screening and evaluation process analysing over 600 quantitative data points per company+ – before reaching its investor network. Fundnel's network of investors then perform their own assessment before making an ""Anchor Investment"" in a particular deal they see value in. Only deals with a lead anchor investor will be listed on its platform, whereupon other investors are invited to join the investment round.Fundnel is headquartered in Singapore and has a growing team of over twenty people spread across regional offices in Indonesia, Malaysia and India.",Singapore,Singaporean,['SGD'],"['Mandarin', 'English', 'Malay', 'Tamil']"
67,Data Analyst Staff,,FULL_TIME,1,3,True,1,False,"JOB DESCRIPTION:Doing data selection, preparation and data analysis using different data mining method.Interpret data, analyze results using statistical techniques and provide ongoing report.Importing, cleaning, transforming, validating or modeling data with the purpose of understanding or making conclusions from the data for decision making purpose.Work with management to prioritize business and information needs.Keep pace with analytics, technology and marketing industry trendsJOB REQUIREMENT:Min. Bachelor's degree in Information System, IT, Computer Science, Information Management, Statistics, Mathematics or equivalentAt least min. 1 year(s) of working experience in Data Analyst is required for this positionStrong analytical skills with the ability to collect, organize, analyze and disseminate significant amounts of information with attention to detail and accuracyTechnical expertise, regarding data models, database design development, data mining and segmentation techniquesKnowledge of statistics and experience using statistical packages for analyze datasetsLearn database, SQL, data visualization, customer insightGood Skill and knowledge of using statistical analysis methods such as clustering, regression and classificationRequired language(s): Bahasa Indonesia and English",ID,MONTH,3500000.0,4500000.0,IDR,Qwords,"Salary attractive and negotiable, according to the ability of the applicant. Given special allowance and additional bonuses to staff who excel, and a clear career path.",False,False,True,"Qwords adalah perusahaan di bidang jasa layanan IT dengan beberapa anak perusahaan dengan kantor di Jakarta, Bandung, Yogyakarta dan Surabaya. Dengan dukungan teknis 24 jam, kami telah melayani lebih dari 35.000 klien aktif dan terus berkembang setiap harinya, hingga masuk ke dalam 10 besar perusahaan web hosting di Indonesia.",Indonesia,Indonesian,['IDR'],['Indonesian']
68,Data Scientist - LECTURER,,FULL_TIME,1,3,True,4,False,"Job description & requirementsBackground of recruitment:
We are running a data science bootcamp, named make.ai. Currently, we are trying to educate people about data science since  the market of data science in industry is getting increased.Thus, we are recruiting experienced data science (or machine learning) lecturerJob Desscription:
- Teach about Python (base programming language)
- Teach about Stats & Math
- Teach about Data Visualization (graph)
- Teach about AI (Machine Learning & Deep Learning)
- Make presentationMandatory:- Initiative- Presentation skills- The ability to write reports and proposals- The capacity to work well on your own or in a team- The ability to manage your time and plan your day effectivelyRecruitment Workflow- Send CV- Assignment of data science with report- Interview (general, technical)Ø Presentation about report in assignment- Final result",ID,MONTH,5000000.0,7000000.0,IDR,Pt Renom Infrastruktur Indonesia, Enrich people's life by posing innovation to the infrastructure which functionalize all of the social activities and our daily life,False,False,True,"Through GRID inc corporate culture, we aim to enrich people's life by posing innovation to the infrastructure which functionalize all of the social activities and our daily life.We encourage you to explore our website and call us to discuss our commitment to connecting you with those that will drive your business, embrace your vision and grow your bottom line. Because of your trust in us, we will continue to seek new and innovative solution that will save you time and money.",Indonesia,Indonesian,['IDR'],['Indonesian']
69,Data Scientist - Image Recognition,,FULL_TIME,1,3,True,3,False,"MOES DS REQUIREMENT: (EN)1. Capable to use Python/R programming language2. Capable to use data analytic tools (e.g. Pandas, Matplotlib, Numpy)3. Capable to use machine learning & deep learning technology and their models (e.g. CNN, Random Forest, Xgbboost, etc)4. Have experience in Image Analysis project (at least involved in and finished 1 Image Analysis development project)5. Good intuition in analyzing & make hypothesis related to image content & quality with AI model performance6. Have 2 years data scientist experience7. Have bachelor degree in engineering major or similar (Computer Science, Mathematics, Physics, etc)8. Have experience in AI model development for mobile platform (optional)",ID,MONTH,7000000.0,9000000.0,IDR,Pt Renom Infrastruktur Indonesia, Enrich people's life by posing innovation to the infrastructure which functionalize all of the social activities and our daily life,False,False,True,"Through GRID inc corporate culture, we aim to enrich people's life by posing innovation to the infrastructure which functionalize all of the social activities and our daily life.We encourage you to explore our website and call us to discuss our commitment to connecting you with those that will drive your business, embrace your vision and grow your bottom line. Because of your trust in us, we will continue to seek new and innovative solution that will save you time and money.",Indonesia,Indonesian,['IDR'],['Indonesian']
70,Data Science Developer (4 mths contract),,FULL_TIME,0,1,True,1,False,"You’re a curious and business driven builder, someone excited about creating software that works way better than competing solutions for global users. Together, we’ll create and iterate on data protection tools of the future—and grow our Cloak Apps user base, one referral at a time.This position is with Cloak’s data science consulting team. We help our enterprise clients makes smart decisions amid a fast moving and uncertain future, by transforming existing data into useful insights and compelling stories. You are expected to follow best-in-class processes of data preparation, data analytics, deep machine learning, visualization and business consulting to create rewarding values for our esteemed clients. If you love bringing creative flair to complex challenges, and you’re pretty handy with cutting code as well as high intensity business preparation, our A-Team wants to talk with YOU.Cloak enables security in cloud-based data storage and applications. A fast growing startup, Cloak won multiple awards with its Cloak Apps Data Protection Software-as-Service.This is your opportunity to join an energetic and experienced team based in Malaysia Johor or Singapore, and build customized secure solutions for our enterprise customers, on multi-platforms such as iOS, Android, Mac OS X and Windows platforms.Responsibilities:• Conceptualize, build and validate machine learning model using proven and experimental techniques.• Improve existing machine learning or suggest state-of-art solutions to achieve company's business goal, through activities such as define hypotheses, develop and execute necessary tests, experiments and analysis.• Develop machine learning solution based on team’s analysis• Present confidently your proposals, insights, findings and conclusions to our clientsRequirements:• Masters / Ph.D. in Computer Science, Electrical/Computer Engineering, Operations Research or Mathematics/Statistics Preferred, Or• Top graduating degree in computer science.• Minimum 1 year of relevant experience with machine learning techniques and advanced quantitative analytics (e.g. regression, classification, clustering, time series).• Understanding of NLP, machine learning, deep learning, data mining, algorithmic foundations of optimization.• Proven problem-solving skills in complex and advanced technical subject.• Basic knowledge of digital marketing.Advantages:• Proficient in one or more of the following programming languages: Python, R, Java, Scala.• Experience with machine learning framework (tensorflow, scikit-learn, Spark MLlib etc).• Experience in building ML models at scale, using real-time big data pipelines on platforms such as Spark/MapReduce.• Extensive knowledge of mobile & web technologies, mobile & web application design and development.• Solid background in programming in Swift, Objective C, Java, PHP, Ajax, Adobe Flex, SQL (relational DB). Knowledge in other programming languages including scripting languages is a plus.• Knowledge of crypto APIs on Web, iOS and/or Android platforms.Please email hr@cloakapps.com for any queries. We look forward to speak to you.",SG,MONTH,4000.0,4000.0,SGD,Cloak Pte. Ltd.,Cloak Your Data For a Safer Tomorrow,False,False,True,"Cloak is incorporated in 2011 to solve the problem of a lack of good data security SDKs to enable fast and flexible federated data security across cloud, mobile and desktop platforms. Between 2011 and 2015, we developed a suite of Security-as-a-Service (SaaS) built upon our patented Federated Data Sentry (FDS) Platform. Our enterprise customers can accelerate go-to-market time of their secure mobile and cloud applications by leveraging on our SDKs (https://cloakapps.com). We are now seeking great developers who are confident to design present and implement secure mobile and web solutions to our potential enterprise clients. Join us now and make the cloud a more secure place!",Singapore,Singaporean,['SGD'],"['Mandarin', 'English', 'Malay', 'Tamil']"
71,Data Analyst,,FULL_TIME,3,5,True,18,False,"Being part of the Business Optimization team, the incumbent will focus on maximizing conversion funnels (Awareness, Acquisition, Engagement, Retention) by deep diving into the analytics to find opportunities to optimize the business in Hong Kong and the regional markets.The JobInterpret business requirements and determines optimum BI solutions for a wide range of requests from internal teamsConsolidate and process data for regular reports, provide insights and performance trackingDesign and build BI dashboards for business analysis and ad-hoc projects and will need to work closely with data engineersMarket segmentation through extracting behaviours from database for marketing automationProvide A/B testing plans and analyze the testing results to optimize traffic, marketing efficiency and subscription revenueExplore the data and discover patterns and correlations to define trends, make predictions and uncover root causes for certain phenomenasThe PersonDegree holder in Business Administration, Statistics, Information System, Computing Science or related disciplines with related work experience3 to 5 years of experience in data extraction or programming using SQL languageHands on experience with Business Intelligence (BI) or data visualisation tools is a must (proficiency in Excel; strong experience in Tableau, Cognos, Qlikview, Power BI or BusinessObjects)Experience in Data Mining (SPSS, R/Python, SAS) is an advantageGood understanding and knowledge of RDBMS and Data Warehouse including Star schema DBExcellent analytical and problem solving skills and sensitivity to numbers and data",HK,MONTH,20000.0,50000.0,HKD,Keyteo,"We are a Belgium IT Consulting firm, present in 6 countries, 7 cities, specialized in hiring and deploying IT professionals on digital projects at our clients (banking, insurance, retail, oil and gas, transportation, pharmaceuticals, e-commerce, etc)!",False,False,True,"Keyteo Consulting offers strategic, operational and technological solutions intended to accompany clients as they carry out their projects, by providing complete expertise. Keyteo Consulting is strongly dedicated to sustain the strong growth of companies specializing in key sectors such as banking/finance and others !",Hong Kong SAR China,Hong Konger,['HKD'],"['English', 'Chinese']"
