,title,intro,type,min_year_exp,max_year_exp,is_public,num_of_hires,is_remote,job_description,country_code,sal_mode,sal_min,sal_max,sal_currency_code,comp_name,comp_tagline,comp_verification,comp_is_hiring,comp_local_office,comp_description,country_name,country_demonym,country_currency,country_language
137,Data Analyst,"PT. Quintal Edutama Solusindo is a software company, we are looking for candidates for several positions",FULL_TIME,0,50,True,1,False,"Job DescriptionAcquire data from primary or secondary data sources.Interpret data, analyze results using statistical techniques.Work closely with management to prioritize business and information needs.Design, create and maintain relational databases and data systems.Triage code problems and data-related issues.RequirementsBachelor’s degree in Engineering (Computer/Telecommunication), Information System, Information Technology, Industrial Engineering, Mathematics, Statistics or equivalent with minimum GPA 3.00+.Fresh grads are welcome to apply.Fluent in English.Knowledge in RDBMS and programming fundamentals.Solid programming fundamental (Minor programming required, onsite training will be provided).Moderate to advanced Microsoft Excel skills.Genuine interest in improving the quality of Indonesian education.Outgoing and service level attitude focusing on customer satisfaction.Ability to translate general user requirements to geek language and vice versa.Meticulous professional aiming for total correctness.Benefits5-days lunchFree parking",ID,,,,,PT Quintal Edutama Solusindo,,False,False,True,PT. Quintal Edutama Solusindo is a software company that focuses in the education industry. Our flagship product Quintal is an Integrated Learning Management and Student Information System that supports Indonesian SchoolsOur company philosophy revolves around:Customer SatisfactionTeam Happines and CohesivenessContinuous Self Enrichment,Indonesia,Indonesian,['IDR'],['Indonesian']
138,Data Analyst Officer,Are you a person who loves to maximize the use of data? Click here.,FULL_TIME,0,50,True,5,False,"Job DescriptionInterpreting data, analyzing results using statistical techniquesDeveloping and implementing data analyses, data collection systems and other strategies that optimize statistical efficiency and qualityAcquiring data from primary or secondary data sources and maintaining databasesRequirementsMinimum Bachelor Degree in Math or StatisticsFluency in English is a plusHave computer literacy skillsStrong analytical skills with the ability to collect, organize, analyze, and disseminate significant amounts of informationKnowledge of statistics and experience using statistical packages for analyzing datasetsAdept at queries, report writing and presenting findingsA great team playerStrong communication skills",ID,MONTH,2700000.0,3500000.0,IDR,PT Multi Garmenjaya,,False,False,True,"Urgently Required Kami adalah Perusahaan Nasional yang bergerak di bidang Garment Manufaktur dan Trading dengan merk dagang terkemuka, saat ini menawarkan peluang karir bagi kandidat potensial untuk bergabung bersama kami",Indonesia,Indonesian,['IDR'],['Indonesian']
139,Senior Application Developer,Manage our payments platform from user interface to back-end services and the interchange of data between the server and the users,FULL_TIME,0,50,True,2,False,"About iPaymyWith iPaymy for Business, SMEs can pay rent, salaries, invoices, and even corporate tax using the credit cards they already have in their wallet today. SMEs love iPaymy because it works like a credit card, but pays like cash.iPaymy’s secure and easy to use platform reliably delivers payments to vendors while freeing up cash and providing access to interest free credit. Forget the delays and aggravations that come with traditional SME financing options. Schedule recurring payments, manage invoices, set payment reminders, and monitor payment status all from one dashboard.It’s never been easier for SMEs to meet monthly payment obligations while keeping cash available to fuel growth, bridge receivable gaps, and make immediate investment in the supplies, services, and expertise needed to drive a growing business forwardiPaymy is experiencing incredible growth and have big plans for 2018 and beyond. If you are ready to join a hungry team of entrepreneurs and think you have what it takes to play a key role on our team, then we would love to hear from you.About the RoleWe are looking for a Senior Web and PHP Developer who will be responsible for managing our payments platform from user interface to back-end services and the interchange of data between the server and the users. Your primary focus will be the design and development of UI elements, the application of UI style and behavior, the communication to server-side logic, maintenance of the central system, and ensuring the high performance and responsiveness of the application engine. This is truly a full stack developer role. This role will be located here at our Engineering headquarters in Singapore.In addition to being responsible for our existing product, you will also be taking part in the continued evolution of the iPaymy platform.  We are looking people who are excited about taking part in designing, architecting, and building the next great thing.What you should haveBachelor of Science Degree in Computer Sciences, Computer Engineering or Software Engineering5+ years of web-based application development experience.Development in an AGILE environmentUnderstanding accessibility and security complianceUnderstanding fundamental design principles behind a scalable application including internationalization, localization, multi-currencyUser authentication and authorization between multiple systems, servers, and environmentA little more of what you should havePHP, preferably with recent experience in PHP7Strong object-oriented backgroundWeb-based technologies: Angular, Bootstrap, CSS, HTML5, JavaScript, AJAX, JSON, XML, jQuery,PHP Frameworks: Such as Laravel, Yii (currently in use), ZendRESTful services and PHP RESTful API frameworksHTTP Servers: Apache, nginxLinux: CentOS, UbuntuService oriented architecture (SOA)Scaling web applications with high trafficUnit testing and load testing websites and API platformsContinuous DeploymentPayment processing and familiarity with PCI complianceProficient understanding of code versioning tools, such as GitBenefitsUnlimited vacation policyAwesome office spaceFree snacks galoreFree Lunch Friday",SG,MONTH,5000.0,8000.0,SGD,iPaymy,"Works like a credit card, but pays like cash.",False,False,True,"iPaymy is changing the way businesses in Singapore manage and pay their monthly expenses. Our secure and easy to use platform enables our customers to use their favourite credit card to pay things like rent, invoices, tax, and employee salaries on their credit card which opens up a whole new world of benefits including the ability optimise working capital and negotiate payment discounts.",Singapore,Singaporean,['SGD'],"['Mandarin', 'English', 'Malay', 'Tamil']"
140,IT Staff ( Operator Data Center CC PLN 123 ),"Currently, we are looking for candidates for positions:",FULL_TIME,0,50,True,1,False,"Menerima ticket berupa notifikasi alert dan email keluhan atau pertanyaan dari komplainant melalui tool incident managementMemberikan konfirmasi kepada agent bahwa ticket dihandleMemberikan bantuan seputar permasalahan yang dihadapi userMelakukan koordinasi dengan komplainant jika dibutuhkanMelakukan koordinasi dengan support sistem jika dibutuhkanMelakukan resolve ticket incident managementMemberikan asistensi sistem kepada userMembuat dokumentasi dalam operasional harianMengumpulkan dokumentasi dan laporan mingguanMelakukan review dan evaluasi mingguanMengumpulkan dokumentasi dan laporan bulananMelakukan review dan evaluasi bulananMemberikan teknikal supportMelakukan sosialiasi fitur baru kepada userMelakukan sosialiasi jika ada gangguan massalGENERAL REQUIREMENTSMinimal pendidikan S1 di bidang teknologi informasi, SI, MI, TK atau bidang yang terkaitBekerja secara shiftingDiutamakan berpengalaman dalam pekerjaan maintenance system lebih dari 2 tahunMengerti konsep cloud computing, LAN dan WANMempunyai kemampuan programmingEDUCATIONMinimal pendidikan S1 di bidang teknologi informasi, SI, MI, TK atau bidang yang terkaitLOCATIONPLN Cinere - GandulAGEThe maximum Aged 35 Years oldBENEFITBasic SaleryAllowance ( meal & transport )BPJS KesehatanBPJS Ketenagakerjaan",ID,,,,,PT Mitra Utama Solusi Telematika,PT. Mitra Utama Solusi Telematika merupakan salah satu unit usaha yang dimiliki oleh Yayasan Penelitian dan Pengembangan Telematika Indonesia,False,False,True,"PT. Mitra Utama Solusi Telematika merupakan salah satu unit usaha yang dimiliki oleh Yayasan Penelitian dan Pengembangan Telematika Indonesia (YPPTI) DITJEN POSTEL di mana yayasan ini mempunyai visi untuk mengembangkan Telematika di seluruh Indonesia.VISIMenjadi Perusahaan profesional terdepan dan menjadi mitra utama dalam menyediakan jasa layanan berkualitas untuk para pelanggan para mitra kerja.MISIMemberi manfaat yang setinggi-tingginya kepada stake holders yang terkait pelanggan / mitra usaha kerja, karyawan dan pemegang saham.Melakukan usaha / jasa layanan / produk yang berkualitas dalam bidang telematika dan jasa layanan umum lainnya.Menangani dan memberikan solusi terhadap kebutuhan pelanggan / mitra usaha kerja dengan cepat, tepat dan tuntas.Kemitraan (Partnership) dengan cara membangun atau membina hubungan baik dengan para pelanggan / mitra usaha kerja untuk kepentingan bersama.",Indonesia,Indonesian,['IDR'],['Indonesian']
141,Data Scientist,"We build a smart feeding solution that can automatically feed the fish, sense the fish’s appetite, and connected to internet.",FULL_TIME,0,50,True,1,False,"ResponsibilitiesAnalyze users and business process and write it down into functional and technical specification for stakeholders.Research, analyze, and provide options for technical solution/technology platform and suggest the optimum one within time-resource constraintRequirementsHave a strong analytical skill, Communication Skill, Good attitude, Good Command in EnglishHaving passion in databases, data analysis and statistics.Providing insights based on data, includes data visualization, inference statistics, predictive modeling, machine learning, and presentationAble to create a database systemAdaptable to new environments, fast learner, trustworthy, self-motivated & initiative",ID,,,,,eFishery,The Smartest Fish Feeder,False,False,True,"eFishery adalah perusahaan yang bergerak di bidang Smart Fish Feeder. eFishery menciptakan solusi bagi para pekerja di bidang budidaya ikan dan udang. eFishery menciptakan alat yang dapat membantu menjadwalkan pemberian pakan tepat waktu tanpa harus bolak-balik ke kolam.eFishery mengeliminasi ketidakefisienan dalam proses budidaya, dan meningkatkan efektivitas dalam budidaya ikan dan udang. Dengan eFishery, mereka bisa meningkatkan frekuensi pemberian pakan hingga puluhan kali per hari dengan dosis berapapun yang memastikan ikan dan udang makan secara optimal tanpa overfeeding. Mereka juga dapat menggunakan eFishery untuk memaksimalkan penghasilan budidaya mereka.",Indonesia,Indonesian,['IDR'],['Indonesian']
142,Data Analyst & Inventory Staff,"We have a vibrant, creative and innovative corporate culture and provide opportunities for you to develop a career with us.",FULL_TIME,0,50,True,1,False,Job Description :Melakukan dan membuat report stock opname bulananMentracking stock baik menggunakan sistem maupun manualMelakukan analisis data warehouseRequirement :Pendidikan min S1 Matematika/ statistika / akuntansiMemiliki kemampuan berhitung dan telitiBisa dipercaya dan bertanggung jawabDiutamakan domisili di Jakarta Timur dan Utara,ID,,,,,PT Multirasa Nusantara ( YOSHINOYA Japanese Restaurant),"Yoshinoya is the largest fast food chicken/beef bowl chain restaurant in Japan with over 1,000 outlets in Japan and 250 outlets outside Japan.",False,False,True,"Yoshinoya is the largest fast food chicken/beef bowl chain restaurant in Japan with over 1,000 outlets in Japan and 250 outlets outside Japan.Its first restaurant opened in 1899.Yoshinoya restaurants open in Japan, Australia, Hong Kong, Mainland China, Malaysia (no pork), Singapore, Taiwan, Philippines and United States.First Flagship Outlet  opened on June 17th, 2010 at Grand Indonesia, West Mal, Level 3A",Indonesia,Indonesian,['IDR'],['Indonesian']
143,Data Analyst,"If you have a desire to be better and ready to be a challenge, do not hesitate to join our team!",FULL_TIME,0,50,True,1,False,"DESKRIPSI PEKERJAANDengan usia 25 s/d 35 tahunPendidikan minimal D3, diutamakan lulusan StatistikBerpengalaman di bidang yang sama minimal tiga tahunMampu dan terbiasa membuat analisa dataTerbiasa dengan target  dan mampu bekerja di bawah tekananMahir menggunaan program Microsoft Office, Excel dan Power PointJujur, teliti, kreatif, komunikatif dan proaktifPenempatan di Jakarta BaratTanggung jawabMembuat analisa tentang pelanggan dan data penjualanMembuat laporan penjualanMenyusun data pendukung bagi Tim MarketingMembuat presentasi atas laporan data penjualan",ID,,,,,PT Grahaexcel Plastindo,We believe that our people are our assets and that everyone in our company is a key player in helping the company to achieve the pinnacle of success,False,False,True,"Since 1969, GRAHAEXCEL PLASTINDO is the pioneer and innovator of plastic industry in Indonesia, which applies Triple Construction System on water and storage tank products. We are committed to present only the best product within its class for our customers.We always attempt to develop and strengthen our Research & Development team to improve our new technology. All EXCEL’s products are manufactured with high technology by experts who passes strong Quality Control in accordance to National Standard of Indonesia (SNI), Japanese Industrial Standard (JIS) and Food and Drug Association (FDA-USA).Our foundation of management is based on The Three Company Concept: “Strong”, “Professional” and “Energetic”. A “Strong” company that delivers outstanding products and services that satisfy consumers. “Professional” – contributes to communities’ health and growth by providing environmental friendly, ethically right and socially responsible products. “Energetic” – having the desire to enhance and improve in every aspect that matters.",Indonesia,Indonesian,['IDR'],['Indonesian']
144,Graphic Design,Membutuhkan seorang wanita untuk mengembangkan data new business dan newbusiness development,FULL_TIME,0,50,True,1,False,"DESKRIPSI PEKERJAANCreate banner, poster and collaterals to fulfill internal design needs.Create customer-centric designs by integrating market objectives, target audience and creative assetsDevelop and contribute to detail our specifications and style guidesRequirements :Highly creative, open minded and have eye for extreme details.Adcance computer (adobe) softwareFresh graduates are welcomed.",ID,,,,,PT Komunikasia,,False,False,True,"PT Komunikasia adalah perusahaan branding/advertising dengan lingkup client nasional.Membutuhkan seorang wanita untuk mengembangkan data new business dan newbusiness development. Pengalaman serupa di bidang yang sama merupakan nilai lebih, walaupun keuletan dan jejak rekam marketing tetap diutamakan.",Indonesia,Indonesian,['IDR'],['Indonesian']
145,Data Entry Staff,"Manipulate and managing big data, click here and join us now!",FULL_TIME,0,50,True,2,False,"Job DescriptionTransferring data from paper formats into computer files or database systemsTyping in data provided directly from customersCreating spreadsheets with large numbers of figures without mistakesRequirementsMinimum of education Bachelors Degree of any discipline, prefer from Law or Legal BackgroundFresh Graduate, prefer has 1 year of working experience as Data Entry or Legal StaffCan speak and understand Bahasa Indonesia and English wellHave strong communication skillsCan operate Computer in MS Windows (Words, Excel, Powerpoint, Email Outlook, etc)A good team playerWilling to work in The Breeze, BSDAvailable to join as soon as possibleWorking schedule Monday to Friday from 09.00 to 18.00 pm (Saturday, Sunday and Public Holiday OFF)",ID,,,,,Lawble,It's Time to Understand The Law,False,False,True,"Lawble is an innovative legal tool that aims to simplify and enhance user experience in understanding and utilizing the Law. Despite being an inseparable part of our lives, many people (legal practitioners notwithstanding) still find the Law too complicated to grasp. We exist to bridge this gap by using innovative technology enhance our interaction with the Law, supporting legal practitioners and, more importantly, educating the masses.With more than 30,000 rules and regulations scattered across 90+ sources, Lawble provides features to access everything you need in a matter of seconds, complete with tools to help you add value in your legal research projects.Our features include:Search: Lawble simplifies searching for relevant rules and regulations, free of advertisements and unrelated web contents.Read: Lawble enhances your reading experience through personalization of formats, as well as automated viewing of rule references and elucidations.Work: Lawble supports your legal research through advanced document marking tools to better arrange your ideas and findings to allow better construction of legal deliverables.Collaborate: Lawble complements collaboration between legal practitioners through an extensive legal project page to promote seamless and intuitive discussions and deliberations on the go.Lawble is owned and managed by PT Karya Digital Nusantaravia www.lawble.com",Indonesia,Indonesian,['IDR'],['Indonesian']
146,Staff Entry Data Processing,Menjadi perusahaan kurir tercepat dan terpercaya di nusantara,FULL_TIME,0,50,True,1,False,"DESKRIPSI PEKERJAANMenginput data di system dengan cepat dan teliti.Mencocokan data yang telah diinput.Berkoordinasi dengan tim operasional dan customer service.Dapat bekerjasama dengan tim.Membantu membuat manifest data pengiriman.Requirement:Usia Maks. 25 tahunPendidikan Min. SMK/SMA Nilai Rata-rata UN 7,00Menguasai & lancar menggunakan Microsoft Office (Ms. Word, Ms. Excel), Internet & email.Penempatan Jakarta, Tangerang, Bekasi, Cimanggi, Cengkareng.",ID,,,,,PT Satria Antaran Prima,,False,False,True,"Dengan Masuknya abad 21 atau millennium ke III, dunia semakin kompetitif, persaingan tepat waktu dan sebagainya menjadi modal utama kelangsungan suatu perusahaan. SAP Express adalah Perusahaan jasa yang mengkhususkan diri dalam bidang kurir dan kargo, SAP Express berdiri sejak tahun 2014 dan merupakan salah satu perintis jasa kurir di Indonesia yang menggunakan sistem online di seluruh cabang maupun jaringan di seluruh Indonesia dikelolah oleh para profesional dibidangnya selama puluhan tahun.Didirikan : Pada Tahun 2014Kantor Pusat : Jln. Pancoran Timur Raya No. 9 Pancoran, Jakarta Selatan 12780 IndonesiaTelp : 021 799 2400Fax : 021 799 4252www.sap-express.comDengan Menggunakan Jasa Kurir, keuntungan perusahaan pengguna adalah sebagai berikut :Resiko MengecilMengehemat waktuMenghemat biaya-biayaReport yang di hasilkan Up to dateKepercayaan mitra kerja bertambahVISIMenjadi perusahaan kurir tercepat dan terpercaya di nusantaraMISIBerkembangMeningkatkan manfaat bisnis bagi pelanggan dan rekan kerjaSumberdaya ManusiaMerekrut, menghasilkan dan mempertahankan karyawan karyawan terbaikKerja TimMenuntuk komunikasi yang terus menerus dengan seluruh anak perusahaan untuk memastikan keefektifan kerja tim yang sosial dan terpaduPelayananMenyediakan tambahan pelayanan yang memudahkan pelanggan dan rekan kerjaInformasi TeknologiMeningkatkan upgrade teknologi terbaru",Indonesia,Indonesian,['IDR'],['Indonesian']
147,Auditor Staff,Have ability to manipulate large data? Click here for more.,FULL_TIME,0,50,True,1,False,"Job DescriptionPerforming the full audit cycle including risk management and control management over operations’ effectiveness, financial reliability and compliance with all applicable directives and regulationsDetermining internal audit scope and developing annual plansObtaining, analyzing and evaluating accounting documentation, reports, data, flowcharts etcRequirementsMinimum Bachelor's Degree in Economic, Accountant, or BankingMinimum 1 year experience as an AuditorFluency in EnglishHave computer literacy skillsProven knowledge of auditing standards and procedures, laws, rules and regulationsHigh attention to detail and excellent analytical skillsSound independent judgementStrong communication and presentation skillsA good team player",ID,,,,,Alfaland Group Indonesia,,False,False,True,"Having a motto force to build and boost harmony in community and milieu, Alfaland Group continues to present the best in the Property commodity. Standing since 1999 as real estate developers, Alfaland has expanded its property business in Developer Unit, Property Management, and Hospitality Management, constantly pushing forward innovation, technology, and customer service.",Indonesia,Indonesian,['IDR'],['Indonesian']
148,Data Scientist Officer,Are you an expert in managing data? Click here and become a professional data scientist.,FULL_TIME,0,50,True,1,False,"Job DescriptionUndertaking data collection, preprocessing and analysisBuilding models to address business problemsPresenting information using data visualization techniquesRequirementsMinimum Bachelor's Degree in Computer Science, Information Systems, Mathematics, Physics, Quantity Survey, Science and Technology or equivalent.Minimum 1 years of experience in the related fieldsFluent in EnglishExtract huge volumes of data from multiple internal and external sources.Employ sophisticated analytics programs, machine learning, and statistical methods to prepare data for use in predictive & prescriptive modeling.Thoroughly clean and prune data to discard irrelevant information.Explore and examine data from a variety of angles to determine hidden weaknesses, trends, and opportunities.Devise data-driven solutions to the most pressing challenges.Invent new algorithms to solve problems and build new tools to automate work.Communicate predictions and findings to management and IT departments through effective data visualizations and report.",ID,,,,,PT Media Wave Interaktif,"MediaWave adalah First Indonesia Social Media Monitoring &Analysis,  merupakan market leader untuk industri ini.",False,False,True,"MediaWave adalah First Indonesia Social Media Monitoring &Analysis,  merupakan market leader untuk industri ini. Didirikan pada tahun 2010, MediaWave merupakan produk karya anak bangsa dan berhasil mengalahkan berbagai platform dari luar negeri dalam melayani puluhan Brand di Indonesia. MediaWave bekerjasama dengan Frontier Marketing Group dan Majalah Marketing sejak tahun 2011 mengadakan Social Media Award yang memberikan penghargaan kepada Brand yang dibicarakan secara positif di Media Sosial.PT MediaWave Interaktif (Bandung) adalah perusahaan yang sedang berkembang saat ini membutuhkan karyawan.Kami bangga dalam budaya tim kami yang kuat,saling percaya, terus belajar, berbagi, dan saling peduli. Kami menyediakan lingkungan kerja yang nyaman dan kondusif agar meningkatkan produktivitas dan perkembangan pribadi karyawan kami. Kami mencari professional muda yang memiliki motivasi, dinamis, kreatif, inovatif, bertanggung jawab dan disiplin, serta bersedia untuk maju bersama kami.",Indonesia,Indonesian,['IDR'],['Indonesian']
149,"SENIOR IT DATA WAREHOUSE, BI & REPORTING","Saat ini Kami mengundang Anda para tenaga Professional Muda, Handal, dan Memiliki Motivasi Tinggi untuk bergabung",FULL_TIME,0,50,True,1,False,"Kualifikasi:
 pendidikan minimal S1 Teknik InformatikaPengalaman kerja min. 3 tahun sebagai Data Warehouse dan BI Spv/CoordMempunyai pengalaman Implementasi Data Warehouse dan BI (Business Intelligence)Mempunyai pengalaman dan pengetahuan yang baik mengenai; SQL Server, Data Warehouse Modeling dan ETL Processing, OLAP, SQL Server Reporting Service, BI Tools seperti Pentaho, Talent, Qlik, atau TableuMemiliki kemampuan unutuk melakukan Data VisualizationMenguasai bahasa pemrograman seperti T-SQL, Java, PHP, Ajax, HTML dan/atau CSS adalah nilai plusMemiliki pengalaman dalam pemrograman android adalah nilai plusMemiliki pengalaman IT dibidang properti adalah nilai plusMemiliki hubungan interpersonal yang baik, kemampuan komunikasi, mampu bekerja secara mandiri atau sebagai sebuah tim.Memiliki kemampuan leadership yang baik.Cepat belajar, bekerja keras, dapat bekerja dibawah tekanan, dan disiplinDeskripsi Kerja:Melakukan koordinasi dengan departemen yang membutuhkan report, melakukan analisa data dan membuat desain sistemMembangun dan melakukan implementasi Data Warehouse dan BI sesuai dengan kebutuhanMemberikan training kepada user yang membutuhkan mengenai semua modul yang berkaitan dengan data warehouse dan BI sistemMelakukan pemeliharaan dan pengembangan berkaitan dengan data warehouse dan BI SistemMemberikan support kepada user yang membutuhkan berkaitan dengan data warehouse dan BI sistem",ID,,,,,Alfaland Group Indonesia,,False,False,True,"Having a motto force to build and boost harmony in community and milieu, Alfaland Group continues to present the best in the Property commodity. Standing since 1999 as real estate developers, Alfaland has expanded its property business in Developer Unit, Property Management, and Hospitality Management, constantly pushing forward innovation, technology, and customer service.",Indonesia,Indonesian,['IDR'],['Indonesian']
