,title,intro,type,min_year_exp,max_year_exp,is_public,num_of_hires,is_remote,job_description,country_code,sal_mode,sal_min,sal_max,sal_currency_code,comp_name,comp_tagline,comp_verification,comp_is_hiring,comp_local_office,comp_description,country_name,country_demonym,country_currency,country_language
222,Database Specialist,Build database systems of high availability and quality depending on each end user’s specialized role.,FULL_TIME,0,50,True,1,False,"The OpportunityRuangguru has been very consistently and closely working with both national and local government—across departments. They believe that this collaboration is vital not only to help boost their growth but also to sustain their impact to Indonesia’s public and private education system. Therefore, unlike many other startups, Ruangguru.com has a specific department which responsible for building collaboration and meaningful relationship with the government bodies and their officials—and you will be part of it.What You Will LearnJob DescriptionAs a Database Specialist you will be expected to design and implement database in accordance to end users’ information needs and views. You will define users and enable data distribution to the right user, in appropriate format and in a timely manner using high-speed transaction recovery techniques and backup data.You will also be responsible for minimizing database downtime and manage parameters to provide fast query responses, provide proactive and reactive data management support and training to users. Furthermore, you will determine, enforce and document database policies, procedures and standards. You will also perform tests and evaluations regularly to ensure data security, privacy and integrity. Finally, you will monitor database performance, implement changes and apply new patches and versions when required.RequirementsProven working experience as a Database engineer or administratorFamiliarity with structured database and NoSQL Databases toolsHands-on experience on database management, performance tuning in high traffic environmentExcellent knowledge of data backup, recovery, security and integrityFamiliarity with database design, documentation and codingPrevious experience with DBA case tools and third party tools",ID,,,,,Ruangguru.com,The Largest Tech-Enabled Education Provider In Indonesia,False,False,True,"Dirilis pada April 2014, Ruangguru.com merupakan sebuah perusahaan yang mengembangkan produk dan layanan di bidang teknologi pendidikan. Sejumlah produk yang telah dirilis, antara lain:Situs marketplace pencarian guru privat — mengelola lebih dari 27,000 guru yang menawarkan jasa di lebih dari 100 bidang pelajaran di seluruh Indonesia.Mobile-app yang membantu murid untuk mendapatkan solusi permasalahan belajar secara instan. Misalnya, jika murid menemui kendala saat mengerjakan PR, murid bisa langsung berkomunikasi dengan guru terbaik lewat fasilitas chat dan audio call yang tersedia di dalam aplikasi.Platform learning management system yang memungkinkan murid untuk mengakses ribuan soal latihan dan ujian yang disusun berdasarkan kurikulum 2006 & 2013. Dengan menggunakan fitur analytics yang ada, murid juga dapat memahami perkembangan belajar, kekuatan dan kelemahan, manajemen waktu, hingga strategi belajar yang tepat. Platform ini juga memungkinkan guru di sekolah untuk mengelola kelas belajar secara online (memberikan latihan dan ujian, menghimpun nilai latihan dan ujian, memonitor perkembangan siswa, dll).",Indonesia,Indonesian,['IDR'],['Indonesian']
223,Database Marketing Specialist,"Develop a personalization strategy using multiple channels (email blaster, push notification tools, etc.)",FULL_TIME,0,50,True,1,False,"The OpportunityRuangguru has been very consistently and closely working with both national and local government—across departments. They believe that this collaboration is vital not only to help boost their growth but also to sustain their impact to Indonesia’s public and private education system. Therefore, unlike many other startups, Ruangguru.com has a specific department which responsible for building collaboration and meaningful relationship with the government bodies and their officials—and you will be part of it.What You Will LearnJob DescriptionAs a Database Marketing Specialist you will be responsible for creating database segmentation of emails for lead generation, tailoring marketing messages to individual customer needs based on database segmentation and scheduling and coordinating text and creative content with other business functions. Additionally, you will manage, track and analyze campaigns.RequirementsBachelor's degree in Marketing or any related fieldExperienced in managing email/push notification campaignsBackground in customer acquisition, re-engagement and retention strategiesEntrepreneurial and customer-centric mindsetExperience working in a startup or dynamic high-growth company a plusFluent in English, both spoken and written",ID,,,,,Ruangguru.com,The Largest Tech-Enabled Education Provider In Indonesia,False,False,True,"Dirilis pada April 2014, Ruangguru.com merupakan sebuah perusahaan yang mengembangkan produk dan layanan di bidang teknologi pendidikan. Sejumlah produk yang telah dirilis, antara lain:Situs marketplace pencarian guru privat — mengelola lebih dari 27,000 guru yang menawarkan jasa di lebih dari 100 bidang pelajaran di seluruh Indonesia.Mobile-app yang membantu murid untuk mendapatkan solusi permasalahan belajar secara instan. Misalnya, jika murid menemui kendala saat mengerjakan PR, murid bisa langsung berkomunikasi dengan guru terbaik lewat fasilitas chat dan audio call yang tersedia di dalam aplikasi.Platform learning management system yang memungkinkan murid untuk mengakses ribuan soal latihan dan ujian yang disusun berdasarkan kurikulum 2006 & 2013. Dengan menggunakan fitur analytics yang ada, murid juga dapat memahami perkembangan belajar, kekuatan dan kelemahan, manajemen waktu, hingga strategi belajar yang tepat. Platform ini juga memungkinkan guru di sekolah untuk mengelola kelas belajar secara online (memberikan latihan dan ujian, menghimpun nilai latihan dan ujian, memonitor perkembangan siswa, dll).",Indonesia,Indonesian,['IDR'],['Indonesian']
224,Data Engineer,Collect and analyze data from various resources to solve problems.,FULL_TIME,0,50,True,1,False,"The OpportunityLaunched in April 2015, Cermati is a company engaged in financial technology. The founders of this innovative start-up are veteran technology experts who have experiences in global technology companies, such as Google, LinkedIn, Microsoft and Oracle. Cermati.com provides a wide range of information to help Indonesians find the best financial products. Cermati also provides free data access to thousands of financial products to help Indonesians make financial decisions carefully.The best thing about Cermati is that this company not only has high-quality individuals in the team, but also the latest technology and work equipment to support their activities. Expect to be working in a full-of-inspiration kind of environment.What You Will LearnJob DescriptionAs a Data Engineer, you will be required to deliver insights about the business, the products, and the market. You will also develop and enhance data pipeline, architecture, and infrastructure. You will also be expected to explore and examine data from multiple angles, coordinate with other departments to fulfill their data requirements. Additonally, you will be responsible for data modeling using analytics programs, machine learning, and statistical methods.RequirementsBachelor’s degree in Maths, Physics, Computer Science, Engineering, or any similar majorPassion for data analysis, data mining, statistics, modeling, and/or pattern recognitionKnowledgeable in modeling, data mining, and big data analysisFamiliar with SQLGreat communication skills and attention to detailsAble to translate data into executable business insights",ID,,,,,Cermati,Mari jadikan Indonesia cermat berfinansial,False,False,True,,Indonesia,Indonesian,['IDR'],['Indonesian']
225,Data Entry Executive,"Organized and quick with the computer, to input data from various sources into business softwares.",FULL_TIME,0,50,True,2,False,"The OpportunityThis is a role with possible attachments to multi-million dollar projects. Suitable Candidates will need to possess work efficiency with the computer or laptop. They are required to organize and enter data into different platforms and software. Fresh Graduates from any fields of study are welcomed. Training will be provided.What You Will LearnExcel SkillsData EntryTable Sorting and OrganizingData ManipulationComputer SkillsSoftware LiteracyJob DescriptionAttached to a Project Engineer and Project Manager. Candidate will be required to manipulate, organize and input data as instructed. They will also learn the ropes of the software and project to better understand what the data is used for. Great for work experience gathering since project attachments are large scale projects for big companies.RequirementsComputer LiteracyMicrosoft Office Basic ProficiencyAble to communicate in EnglishWork 5 days a week, from 9 am to 6 pmDedicated and Committed",SG,MONTH,1600.0,,SGD,Advantechnologies Pte Ltd,Giving you the IT Advantage,False,False,True,Empowering Lives through Business IT solutions,Singapore,Singaporean,['SGD'],"['Mandarin', 'English', 'Malay', 'Tamil']"
226,"Application specialist, development","Development project using Microsoft .Net with C#, MSSQL Server Database, Oracle, webservices",FULL_TIME,0,50,True,1,False,"The OpportunityYou will be involved in the design, maintenance and development of applications and conducting deployment training for users. This will include the gathering of user requirements, rendering production support and be responsible for all related applications matters as assigned.What You Will LearnJob DescriptionDegree in IT or equivalent with at least 2 years or Diploma with at least 5 years development experience Knowledge of shipping processes, strong business/functional requirement management and project management skillset is required  Familiarity and exposure to Microsoft .Net with C#, MSSQL Server Database, Oracle, webservices is required. Good communication & interpersonal skills, creative & ability to multitask  A team player who is able to work with minimal supervision  Candidates with more years of experience may be considered for senior position.FRESH IT GRADUATES ARE WELCOME TO APPLYRequirements",SG,MONTH,2800.0,,SGD,Avensys Consulting,Avensys is a leader in providing technology enabled business solutions and services.,False,False,True,"Avensys is a leader in providing technology enabled business solutions and services. Since inception, Avensys has helped clients use IT more efficiently to improve their operations and profitability, focus on core competencies and achieve business results such as increased agility, innovation and profitable growth.Our in-depth technical knowledge coupled with industry experience and our unique methodologies enable us to successfully deliver and meet our customer’s expectations.",Singapore,Singaporean,['SGD'],"['Mandarin', 'English', 'Malay', 'Tamil']"
227,Senior Backend / Database Developer (Big Data),Website: www.tapway.com.my,FULL_TIME,0,50,True,1,False,"The OpportunityIf you like the dynamic nature of a fast-growing startup, join us on this differentiated experience and adventure to blossom in the age of analytics and big data revolution.What You Will LearnTapway is building the next-generation shopper intelligence platform for brick-and-mortar businesses so they could improve their business with real-time analytics and personalized engagements. Thus, we are looking for a backend developer or engineer to:Partnering with the analytics team to architect and build Tapway’s big data platformBuilding tools and services to maintain a robust, scalable data service layerDesign, develop and implement real-time and batch data processing systems by working with our sensor data and other data sourcesManage both SQL and NoSQL databases (i.e. PostgreSQL, DynamoDB, Hbase, Cassandra, etc)Job DescriptionJob DescriptionVibrant and dynamic start-up environmentGreat growth potential in a fast-growing big data industryTapway is building the next-generation shopper intelligence platform for brick-and-mortar businesses so they could improve their business with real-time analytics and personalized engagements. Thus, we are looking for a backend developer or engineer to:Partnering with the analytics team to architect and build Tapway’s big data platformBuilding tools and services to maintain a robust, scalable data service layerDesign, develop and implement real-time and batch data processing systems by working with our sensor data and other data sourcesManage both SQL and NoSQL databases (i.e. PostgreSQL, DynamoDB, Hbase, Cassandra, etc)Development of various API’s and data connectors to interact with front-end and other data warehousesHave fun in a highly dynamic team and drive innovations to continue as a leader in one of the fastest-growing industriesRequirementsJob RequirementsCandidate must possess at least a Bachelor’s Degree in Computer Science, Information System or related discipline. MSc is a plus.At least 3 years of work experience in related fields.Excellent knowledge of PythonStrong OOP skillsSQL knowledge, including exposure to or experience with NoSQL databases (i.e. HBase, Cassandra)Experience with Amazon Web Services, especially DynamoDBExperience with big data infrastructure (including Spark and Hadoop) is a plusBasic knowledge or understanding of Lambda architecturesPassion and interest for all things distributed - file systems, databases and computational frameworksIndividual who is passionate, resourceful, self-motivated, highly committed, a team player and able to motivate othersAbility to learn quicklyGood verbal and written communication.Must be willing in work in highly dynamic and challenging startup environment.",SG,,,,,Tapway,Big Data Customer Experience,False,False,False,"Tapway is a startup with relentless focus on bringing innovative cloud-based, mobile-focused big data analytics solutions for retail industry and beyond.We are essentially creating the Google Analytics for the real world by providing a comprehensive in-store analytics platform which integrates various data sources such as WiFi, video, POS, CRM, weather, traffic etc to deliver a complete picture of store performance for retailers.If you like the dynamic nature of a startup, join us on this differentiated experience and adventure to blossom in the age of analytics and big data revolution.Website: www.gotapway.com",Singapore,Singaporean,['SGD'],"['Mandarin', 'English', 'Malay', 'Tamil']"
228,Software Engineer,"Join the Fraud engineering team at Go-Jek. We're a team of data scientists, engineers, and core business units that fight crime together.",FULL_TIME,0,50,True,10,False,"The OpportunityWhat You Will Learn● Practice quality engineering : TDD, agile on a cutting edge stack. There are a lot of resources poured into training our computer scientists.● World-class mentorship : Fraud is a cross-functional team. You’ll work with the likes of our CTO (former head of Thoughtworks) and our data science/AI team from Stanford/Cal/MIT, doing deep learning and AI.●  Unprecedented scalability : Given GoJek’s 16+ products, we build for scale and variety.Job Description● Example Responsibilities  ● Setup real time data pipelines that power GoJek’s business and engineering ● Build backend services for a fraud detection platform ● Embed in financial fraud solutions with GoPay ● Generate insights and tooling around our 16+ productsRequirementsA  fullstack engineer  OR  data engineer ● Experience with any of the below: ○ Data pipelines, distributed systems, large-scale data processing ○ Web applications or software systems ○ Java, Ruby, Go, C++, Python or Javascript (???) ● Positive & enjoy ownership of interesting projects",SG,,,,,Go-Jek,Tech company | Indo's first unicorn,False,False,True,"Founded in 2010, Go-Jek is a mobile technology company with a social mission: to unleash social impact through technology. Since the app’s launch in January 2015, Go-Jek has been a one stop application for daily needs in Indonesia, revolutionizing solutions from transport, logistics and lifestyle services.Go-Jek has a unique entrepreneurial environment, spanning twelve products. Our data science team is based in Singapore, and working on a ton of exciting projects! If you're an independent thinker and all-rounded person, this is the place for you.",Singapore,Singaporean,['SGD'],"['Mandarin', 'English', 'Malay', 'Tamil']"
229,Digital Strategist,Digital brand guardian in content and media management.  A role which requires strong learning ability and data analytical skills .,FULL_TIME,0,50,True,1,False,"The OpportunityYou are a digital strategist who aspires to be in the fast moving space of social media marketing.What You Will LearnJob DescriptionWe are looking for an individual who can support our brands social media and digital communications requirement. The job may also take you to work on internal design jobs and trade consumers in social media collaboration. You will also assist in the design and content production for some of the projects.Your daily task would be to manage different social channels. Listen to what the internet spoke about us.  Monthly, you will also present social media calendar in line with the brand strategy. Last, we like you to be in charge of spending our money wisely. You will also manage a monthly budget and budget allocation for the various media we are engaged in.RequirementsYou should have a good understanding on the fundamentals of marketing and consumer insights. Enjoys varied task an and not afraid to challenge the status quo. You should have a passion for beautiful things, food and fashion alike. Your friends often view you as a opinion leader and someone who embraces trend.You aspire to learn and will seek out knowledge if required. A basic understand of basic SEO & SEM as well as managing Adword account is  required. If you are not Google Adword certified, it's time to go get one.Last, we want to meet you if you are passionate about living and enjoys taking responsibility and seeing things through.",SG,MONTH,2500.0,4000.0,SGD,Gryphon Tea Company,Gryphon Tea is a company on a mission to make the highest-quality gourmet teas for the discerning tea drinker who is always in search of new taste experiences.,False,False,True,"Gryphon Tea Company traces its origins to a family-owned tea importer founded in Singapore almost 100 years ago. In 2006, a fourth-generation member of the family struck out on his own and the company quickly gained a following for its maverick ideas and heady enthusiasm. Gryphon Tea’s growing selection of tea recipes has received numerous industry awards and is now available to consumers worldwide through online shopping and our network of dedicated distribution partners.With the expansion of new products, brands and the growing brand presence both locally and internationally through online and offline, we're looking for an enthusiastic Digital/Creative Strategist to join the team.",Singapore,Singaporean,['SGD'],"['Mandarin', 'English', 'Malay', 'Tamil']"
230,Web Developer,"We are looking for a Web Developer responsible in managing our in-house web applications, modifying, bug fixing and database maintenance.",FULL_TIME,0,50,True,1,False,"Job Description**Responsibilities: ** Web applications maintenance/user support Web applications modification/improvement/data support/bug fixing Involve in new application development projects Database maintenanceRequirementsRequirements:Good knowledge in Python, at least one Python framework, eg Django, Flask etc   Good SQL skill and experience working with MySQL   Understanding of the threading, limitations of Python, and multi process architecture   Good understanding of front-end technologies, eg JavaScript, jQuery, HTML5 and CSS3   Knowledge of user authentication and authorization between multiple systems, servers and environment   Experience in API development   Able to create database schemas that represent and support business processes   Strong application test and debugging skills   Experience in Android app/IOS app development will be a plus   Diploma or relevant job experiences",SG,,,,,Finexis Advisory Pte Ltd,Impacting Lives Beyond Finance,False,False,True,"One of the largest independently-owned financial advisory firm in Singapore. We specialize in comprehensive wealth management for both individual and corporate clients. With the support from our global partners and the focus on developing quality consultants in the firm, we aim to be the preferred financial advisory firm not only in Singapore, but also in the region.",Singapore,Singaporean,['SGD'],"['Mandarin', 'English', 'Malay', 'Tamil']"
231,Data Scientist,"Our data science team is based in Singapore, and working on a ton of exciting projects!",FULL_TIME,0,50,True,1,False,"The OpportunityOur data science team is based in Singapore, and working on a ton of exciting projects! If you're an independent thinker and all-rounded person, this is the place for you.What You Will LearnJob DescriptionSelecting features, building and optimizing machine learning modelsData mining using state-of-the-art methodsExtending company’s data with third party sources of information when neededEnhancing data collection procedures to include information that is relevant for building analytic systemsProcessing, cleansing, and verifying the integrity of data used for analysisDoing ad-hoc analysis and presenting results in a clear mannerBuilding continuous deployments and productionizing machine learning modelsA/B Testing for models evaluationRequirementsAt least 1 -2 years of experience in a data science role working with large data setsSelf-driven and entrepreneurial with a strong sense of ownershipExcellent understanding of machine learning techniques and algorithmsExperience with common data science toolkits, such as Scikit-Learn, R, Weka, MatLab, etcGreat communication skillsPossess good understanding of design thinking, solid CS fundamentalsGood applied statistics skills, such as distributions, statistical testing, regression, etcGood scripting and programming skills.Experienced with Python, R , Golang, Scala, R and ShellAbility to whiteboard some theory while at the same time rolling up your sleeve and get coding Ability to work independently to solve problems and develop solutionsExperience with experimenting on different modelling techniques (supervised and unsupervised learning) and develop data visualisation for data storiesKaggle / Hackathons experience a plus",SG,,,,,Go-Jek,Tech company | Indo's first unicorn,False,False,True,"Founded in 2010, Go-Jek is a mobile technology company with a social mission: to unleash social impact through technology. Since the app’s launch in January 2015, Go-Jek has been a one stop application for daily needs in Indonesia, revolutionizing solutions from transport, logistics and lifestyle services.Go-Jek has a unique entrepreneurial environment, spanning twelve products. Our data science team is based in Singapore, and working on a ton of exciting projects! If you're an independent thinker and all-rounded person, this is the place for you.",Singapore,Singaporean,['SGD'],"['Mandarin', 'English', 'Malay', 'Tamil']"
232,Teradata Developer,3-4 years in Teradata,FULL_TIME,0,50,True,2,False,"The OpportunityTeradata DeveloperWhat You Will LearnTeradataJob DescriptionTeradata 14.10+, TTU 14.10 and above, Physical design, Application Development, Stored Procedures, Scheduling Tools, Performance Optimisation and UNIXGood in Teradata Stored Procedure LanguageGood knowledge of Database tuning, physical design and in-DB application development.Understanding/exposure to GCFR will be a plus point.Good documentation skills.Experienced in any of the Configuration and Scheduling tools.Beginner knowledge of data modelling and Tier 3 designEA License No. - 14C6941Requirements3-4 years in TeradataFinancial Domain Background",SG,MONTH,5000.0,,SGD,Infinite Computer Solutions Pte Ltd,Exciting Times... Infinite Possibilities,False,False,True,"Infinite Computer Solutions Ltd. provides technology based business process solutions, next-gen mobility solutions and product engineering services, specializing in the Healthcare, Banking & Finance, Telecommunications & Technology and Media & Publishing industries, for Fortune 1000 companies. Their solutions build on proprietary industrial frameworks that significantly reduce work effort and cost while providing faster go-to-market speeds and nimble responses to market dynamics, a solution they call Platformization™. Infinite has over 5,000 employees and 8 global delivery centers.",Singapore,Singaporean,['SGD'],"['Mandarin', 'English', 'Malay', 'Tamil']"
